cweid,Name,Weakness Abstraction,Status,Description,Modes Of Introduction,Common Consequences,Detection Methods,potential_mitigation
537,Java Runtime Error Message Containing Sensitive Information,Variant,Incomplete,"In many cases, an attacker can leverage the conditions that cause unhandled exception errors in order to gain unauthorized access to the system.",::PHASE:Implementation::,::SCOPE:Confidentiality:IMPACT:Read Application Data::,,::PHASE:Implementation:DESCRIPTION:Do not expose sensitive error information to the user.::
538,Insertion of Sensitive Information into Externally-Accessible File or Directory,Base,Draft,"The product places sensitive information into files or directories that are accessible to actors who are allowed to have access to the files, but not to the sensitive information.",::PHASE:Implementation:NOTE:OMISSION: This weakness is caused by missing a security tactic during the architecture and design phase.::PHASE:Operation:NOTE:OMISSION: This weakness is caused by missing a security tactic during the architecture and design phase.::,::SCOPE:Confidentiality:IMPACT:Read Files or Directories::,"::METHOD:Automated Static Analysis:DESCRIPTION:Automated static analysis, commonly referred to as Static Application Security Testing (SAST), can find some instances of this weakness by analyzing source code (or binary/compiled code) without having to execute it. Typically, this is done by building a model of data flow and control flow, then searching for potentially-vulnerable patterns that connect sources (origins of input) with sinks (destinations where the data interacts with external components, a lower layer such as the OS, etc.):EFFECTIVENESS:High::",::PHASE:Architecture and Design Operation System Configuration:DESCRIPTION:Do not expose file and directory information to the user.::
539,Use of Persistent Cookies Containing Sensitive Information,Variant,Incomplete,"The web application uses persistent cookies, but the cookies contain sensitive information.",::PHASE:Architecture and Design::PHASE:Implementation::,::SCOPE:Confidentiality:IMPACT:Read Application Data::,"::METHOD:Automated Static Analysis:DESCRIPTION:Automated static analysis, commonly referred to as Static Application Security Testing (SAST), can find some instances of this weakness by analyzing source code (or binary/compiled code) without having to execute it. Typically, this is done by building a model of data flow and control flow, then searching for potentially-vulnerable patterns that connect sources (origins of input) with sinks (destinations where the data interacts with external components, a lower layer such as the OS, etc.):EFFECTIVENESS:High::",::PHASE:Architecture and Design:DESCRIPTION:Do not store sensitive information in persistent cookies.::
540,Inclusion of Sensitive Information in Source Code,Base,Incomplete,Source code on a web server or repository often contains sensitive information and should generally not be accessible to users.,::PHASE:Implementation::,::SCOPE:Confidentiality:IMPACT:Read Application Data::,,::PHASE:Architecture and Design System Configuration:DESCRIPTION:Recommendations include removing this script from the web server and moving it to a location not accessible from the Internet.::
541,Inclusion of Sensitive Information in an Include File,Variant,Incomplete,"If an include file source is accessible, the file can contain usernames and passwords, as well as sensitive information pertaining to the application and system.",::PHASE:Implementation::,::SCOPE:Confidentiality:IMPACT:Read Application Data::,,::PHASE:Architecture and Design:DESCRIPTION:Do not store sensitive information in include files.::PHASE:Architecture and Design System Configuration:DESCRIPTION:Protect include files from being exposed.::
547,"Use of Hard-coded, Security-relevant Constants",Base,Draft,"The product uses hard-coded constants instead of symbolic names for security-critical values, which increases the likelihood of mistakes during code maintenance or security policy change.",::PHASE:Implementation::,::SCOPE:Other:IMPACT:Varies by Context:IMPACT:Quality Degradation:NOTE:The existence of hardcoded constants could cause unexpected behavior and the introduction of weaknesses during code maintenance or when making changes to the code if all occurrences are not modified. The use of hardcoded constants is an indication of poor quality.::,"::METHOD:Automated Static Analysis:DESCRIPTION:Automated static analysis, commonly referred to as Static Application Security Testing (SAST), can find some instances of this weakness by analyzing source code (or binary/compiled code) without having to execute it. Typically, this is done by building a model of data flow and control flow, then searching for potentially-vulnerable patterns that connect sources (origins of input) with sinks (destinations where the data interacts with external components, a lower layer such as the OS, etc.):EFFECTIVENESS:High::",::PHASE:Implementation:DESCRIPTION:Avoid using hard-coded constants. Configuration files offer a more flexible solution.::
548,Exposure of Information Through Directory Listing,Variant,Draft,"A directory listing is inappropriately exposed, yielding potentially sensitive information to attackers.",::PHASE:Implementation::PHASE:Operation::,"::SCOPE:Confidentiality:IMPACT:Read Files or Directories:NOTE:Exposing the contents of a directory can lead to an attacker gaining access to source code or providing useful information for the attacker to devise exploits, such as creation times of files or any information that may be encoded in file names. The directory listing may also compromise private or confidential data.::","::METHOD:Automated Static Analysis:DESCRIPTION:Automated static analysis, commonly referred to as Static Application Security Testing (SAST), can find some instances of this weakness by analyzing source code (or binary/compiled code) without having to execute it. Typically, this is done by building a model of data flow and control flow, then searching for potentially-vulnerable patterns that connect sources (origins of input) with sinks (destinations where the data interacts with external components, a lower layer such as the OS, etc.):EFFECTIVENESS:High::","::PHASE:Architecture and Design System Configuration:DESCRIPTION:Recommendations include restricting access to important directories or files by adopting a need to know requirement for both the document and server root, and turning off features such as Automatic Directory Listings that could expose private files and provide information that could be utilized by an attacker when formulating or conducting an attack.::"
552,Files or Directories Accessible to External Parties,Base,Draft,"The product makes files or directories accessible to unauthorized actors, even though they should not be.",::PHASE:Architecture and Design::PHASE:Implementation:NOTE:OMISSION: This weakness is caused by missing a security tactic during the architecture and design phase.::PHASE:Operation:NOTE:OMISSION: This weakness is caused by missing a security tactic during the architecture and design phase.::,::SCOPE:Confidentiality:SCOPE:Integrity:IMPACT:Read Files or Directories:IMPACT:Modify Files or Directories::,"::METHOD:Automated Static Analysis:DESCRIPTION:Automated static analysis, commonly referred to as Static Application Security Testing (SAST), can find some instances of this weakness by analyzing source code (or binary/compiled code) without having to execute it. Typically, this is done by building a model of data flow and control flow, then searching for potentially-vulnerable patterns that connect sources (origins of input) with sinks (destinations where the data interacts with external components, a lower layer such as the OS, etc.):EFFECTIVENESS:High::","::PHASE:Implementation System Configuration Operation:DESCRIPTION:When storing data in the cloud (e.g., S3 buckets, Azure blobs, Google Cloud Storage, etc.), use the provider's controls to disable public access.::"
564,SQL Injection: Hibernate,Variant,Incomplete,Using Hibernate to execute a dynamic SQL statement built with user-controlled input can allow an attacker to modify the statement's meaning or to execute arbitrary SQL commands.,::PHASE:Architecture and Design::PHASE:Implementation::,::SCOPE:Confidentiality:SCOPE:Integrity:IMPACT:Read Application Data:IMPACT:Modify Application Data::,,"::PHASE:Requirements:DESCRIPTION:A non-SQL style database which is not subject to this flaw may be chosen.::PHASE:Architecture and Design:DESCRIPTION:Follow the principle of least privilege when creating user accounts to a SQL database. Users should only have the minimum privileges necessary to use their account. If the requirements of the system indicate that a user can read and modify their own data, then limit their privileges so they cannot read/write others' data.::PHASE:Architecture and Design:DESCRIPTION:For any security checks that are performed on the client side, ensure that these checks are duplicated on the server side, in order to avoid CWE-602. Attackers can bypass the client-side checks by modifying values after the checks have been performed, or by changing the client to remove the client-side checks entirely. Then, these modified values would be submitted to the server.::PHASE:Implementation:DESCRIPTION:Implement SQL strings using prepared statements that bind variables. Prepared statements that do not bind variables can be vulnerable to attack.::PHASE:Implementation:DESCRIPTION:Use vigorous allowlist style checking on any user input that may be used in a SQL command. Rather than escape meta-characters, it is safest to disallow them entirely. Reason: Later use of data that have been entered in the database may neglect to escape meta-characters before use. Narrowly define the set of safe characters based on the expected value of the parameter in the request.::"
565,Reliance on Cookies without Validation and Integrity Checking,Base,Incomplete,"The product relies on the existence or values of cookies when performing security-critical operations, but it does not properly ensure that the setting is valid for the associated user.",::PHASE:Architecture and Design:NOTE:OMISSION: This weakness is caused by missing a security tactic during the architecture and design phase.::PHASE:Implementation::,::SCOPE:Access Control:IMPACT:Gain Privileges or Assume Identity:NOTE:It is dangerous to use cookies to set a user's privileges. The cookie can be manipulated to escalate an attacker's privileges to an administrative level.::,"::METHOD:Automated Static Analysis:DESCRIPTION:Automated static analysis, commonly referred to as Static Application Security Testing (SAST), can find some instances of this weakness by analyzing source code (or binary/compiled code) without having to execute it. Typically, this is done by building a model of data flow and control flow, then searching for potentially-vulnerable patterns that connect sources (origins of input) with sinks (destinations where the data interacts with external components, a lower layer such as the OS, etc.):EFFECTIVENESS:High::","::PHASE:Architecture and Design:DESCRIPTION:Avoid using cookie data for a security-related decision.::PHASE:Implementation:DESCRIPTION:Perform thorough input validation (i.e.: server side validation) on the cookie data if you're going to use it for a security related decision.::PHASE:Architecture and Design:DESCRIPTION:Add integrity checks to detect tampering.::PHASE:Architecture and Design:DESCRIPTION:Protect critical cookies from replay attacks, since cross-site scripting or other attacks may allow attackers to steal a strongly-encrypted cookie that also passes integrity checks. This mitigation applies to cookies that should only be valid during a single transaction or session. By enforcing timeouts, you may limit the scope of an attack. As part of your integrity check, use an unpredictable, server-side value that is not exposed to the client.::"
566,Authorization Bypass Through User-Controlled SQL Primary Key,Variant,Incomplete,"The product uses a database table that includes records that should not be accessible to an actor, but it executes a SQL statement with a primary key that can be controlled by that actor.",::PHASE:Architecture and Design:NOTE:COMMISSION: This weakness refers to an incorrect design related to an architectural security tactic.::PHASE:Implementation::,::SCOPE:Confidentiality:SCOPE:Integrity:SCOPE:Access Control:IMPACT:Read Application Data:IMPACT:Modify Application Data:IMPACT:Bypass Protection Mechanism::,"::METHOD:Automated Static Analysis:DESCRIPTION:Automated static analysis, commonly referred to as Static Application Security Testing (SAST), can find some instances of this weakness by analyzing source code (or binary/compiled code) without having to execute it. Typically, this is done by building a model of data flow and control flow, then searching for potentially-vulnerable patterns that connect sources (origins of input) with sinks (destinations where the data interacts with external components, a lower layer such as the OS, etc.):EFFECTIVENESS:High::","::PHASE:Implementation:DESCRIPTION:Assume all input is malicious. Use a standard input validation mechanism to validate all input for length, type, syntax, and business rules before accepting the data. Use an accept known good validation strategy.::PHASE:Implementation:DESCRIPTION:Use a parameterized query AND make sure that the accepted values conform to the business rules. Construct your SQL statement accordingly.::"
579,J2EE Bad Practices: Non-serializable Object Stored in Session,Variant,Draft,"The product stores a non-serializable object as an HttpSession attribute, which can hurt reliability.",::PHASE:Implementation:NOTE:REALIZATION: This weakness is caused during implementation of an architectural security tactic.::,::SCOPE:Other:IMPACT:Quality Degradation::,"::METHOD:Automated Static Analysis:DESCRIPTION:Automated static analysis, commonly referred to as Static Application Security Testing (SAST), can find some instances of this weakness by analyzing source code (or binary/compiled code) without having to execute it. Typically, this is done by building a model of data flow and control flow, then searching for potentially-vulnerable patterns that connect sources (origins of input) with sinks (destinations where the data interacts with external components, a lower layer such as the OS, etc.):EFFECTIVENESS:High::","::PHASE:Implementation:DESCRIPTION:In order for session replication to work, the values the product stores as attributes in the session must implement the Serializable interface.::"
598,Use of GET Request Method With Sensitive Query Strings,Variant,Draft,The web application uses the HTTP GET method to process a request and includes sensitive information in the query string of that request.,::PHASE:Architecture and Design::PHASE:Implementation::,"::SCOPE:Confidentiality:IMPACT:Read Application Data:NOTE:At a minimum, attackers can garner information from query strings that can be utilized in escalating their method of attack, such as information about the internal workings of the application or database column names. Successful exploitation of query string parameter vulnerabilities could lead to an attacker impersonating a legitimate user, obtaining proprietary data, or simply executing actions not intended by the application developers.::","::METHOD:Automated Static Analysis:DESCRIPTION:Automated static analysis, commonly referred to as Static Application Security Testing (SAST), can find some instances of this weakness by analyzing source code (or binary/compiled code) without having to execute it. Typically, this is done by building a model of data flow and control flow, then searching for potentially-vulnerable patterns that connect sources (origins of input) with sinks (destinations where the data interacts with external components, a lower layer such as the OS, etc.):EFFECTIVENESS:High::","::PHASE:Implementation:DESCRIPTION:When sensitive information is sent, use the POST method (e.g. registration form).::"
601,URL Redirection to Untrusted Site ('Open Redirect'),Base,Draft,"A web application accepts a user-controlled input that specifies a link to an external site, and uses that link in a Redirect. This simplifies phishing attacks.",::PHASE:Architecture and Design:NOTE:OMISSION: This weakness is caused by missing a security tactic during the architecture and design phase.::PHASE:Implementation::,"::SCOPE:Access Control:IMPACT:Bypass Protection Mechanism:IMPACT:Gain Privileges or Assume Identity:NOTE:The user may be redirected to an untrusted page that contains malware which may then compromise the user's machine. This will expose the user to extensive risk and the user's interaction with the web server may also be compromised if the malware conducts keylogging or other attacks that steal credentials, personally identifiable information (PII), or other important data.::SCOPE:Access Control:SCOPE:Confidentiality:SCOPE:Other:IMPACT:Bypass Protection Mechanism:IMPACT:Gain Privileges or Assume Identity:IMPACT:Other:NOTE:The user may be subjected to phishing attacks by being redirected to an untrusted page. The phishing attack may point to an attacker controlled web page that appears to be a trusted web site. The phishers may then steal the user's credentials and then use these credentials to access the legitimate web site.::","::METHOD:Manual Static Analysis:DESCRIPTION:Since this weakness does not typically appear frequently within a single software package, manual white box techniques may be able to provide sufficient code coverage and reduction of false positives if all potentially-vulnerable operations can be assessed within limited time constraints.:EFFECTIVENESS:High::METHOD:Automated Dynamic Analysis:DESCRIPTION:Automated black box tools that supply URLs to every input may be able to spot Location header modifications, but test case coverage is a factor, and custom redirects may not be detected.::METHOD:Automated Static Analysis:DESCRIPTION:Automated static analysis tools may not be able to determine whether input influences the beginning of a URL, which is important for reducing false positives.::METHOD:Automated Static Analysis:DESCRIPTION:Automated static analysis, commonly referred to as Static Application Security Testing (SAST), can find some instances of this weakness by analyzing source code (or binary/compiled code) without having to execute it. Typically, this is done by building a model of data flow and control flow, then searching for potentially-vulnerable patterns that connect sources (origins of input) with sinks (destinations where the data interacts with external components, a lower layer such as the OS, etc.):EFFECTIVENESS:High::METHOD:Automated Static Analysis - Binary or Bytecode:DESCRIPTION:According to SOAR, the following detection techniques may be useful: Highly cost effective: Bytecode Weakness Analysis - including disassembler + source code weakness analysis Binary Weakness Analysis - including disassembler + source code weakness analysis:EFFECTIVENESS:High::METHOD:Dynamic Analysis with Automated Results Interpretation:DESCRIPTION:According to SOAR, the following detection techniques may be useful: Highly cost effective: Web Application Scanner Web Services Scanner Database Scanners:EFFECTIVENESS:High::METHOD:Dynamic Analysis with Manual Results Interpretation:DESCRIPTION:According to SOAR, the following detection techniques may be useful: Highly cost effective: Fuzz Tester Framework-based Fuzzer:EFFECTIVENESS:High::METHOD:Manual Static Analysis - Source Code:DESCRIPTION:According to SOAR, the following detection techniques may be useful: Highly cost effective: Manual Source Code Review (not inspections):EFFECTIVENESS:High::METHOD:Automated Static Analysis - Source Code:DESCRIPTION:According to SOAR, the following detection techniques may be useful: Highly cost effective: Source code Weakness Analyzer Context-configured Source Code Weakness Analyzer:EFFECTIVENESS:High::METHOD:Architecture or Design Review:DESCRIPTION:According to SOAR, the following detection techniques may be useful: Highly cost effective: Formal Methods / Correct-By-Construction Cost effective for partial coverage: Inspection (IEEE 1028 standard) (can apply to requirements, design, source code, etc.):EFFECTIVENESS:High::","::PHASE:Implementation:STRATEGY:Input Validation:DESCRIPTION:Assume all input is malicious. Use an accept known good input validation strategy, i.e., use a list of acceptable inputs that strictly conform to specifications. Reject any input that does not strictly conform to specifications, or transform it into something that does. When performing input validation, consider all potentially relevant properties, including length, type of input, the full range of acceptable values, missing or extra inputs, syntax, consistency across related fields, and conformance to business rules. As an example of business rule logic, boat may be syntactically valid because it only contains alphanumeric characters, but it is not valid if the input is only expected to contain colors such as red or blue. Do not rely exclusively on looking for malicious or malformed inputs. This is likely to miss at least one undesirable input, especially if the code's environment changes. This can give attackers enough room to bypass the intended validation. However, denylists can be useful for detecting potential attacks or determining which inputs are so malformed that they should be rejected outright. Use a list of approved URLs or domains to be used for redirection.::PHASE:Architecture and Design:DESCRIPTION:Use an intermediate disclaimer page that provides the user with a clear warning that they are leaving the current site. Implement a long timeout before the redirect occurs, or force the user to click on the link. Be careful to avoid XSS problems (CWE-79) when generating the disclaimer page.::PHASE:Architecture and Design:STRATEGY:Enforcement by Conversion:DESCRIPTION:When the set of acceptable objects, such as filenames or URLs, is limited or known, create a mapping from a set of fixed input values (such as numeric IDs) to the actual filenames or URLs, and reject all other inputs. For example, ID 1 could map to /login.asp and ID 2 could map to http://www.example.com/. Features such as the ESAPI AccessReferenceMap [REF-45] provide this capability.::PHASE:Architecture and Design:DESCRIPTION:Ensure that no externally-supplied requests are honored by requiring that all redirect requests include a unique nonce generated by the application [REF-483]. Be sure that the nonce is not predictable (CWE-330).::PHASE:Architecture and Design Implementation:STRATEGY:Attack Surface Reduction:DESCRIPTION:Understand all the potential areas where untrusted inputs can enter your software: parameters or arguments, cookies, anything read from the network, environment variables, reverse DNS lookups, query results, request headers, URL components, e-mail, files, filenames, databases, and any external systems that provide data to the application. Remember that such inputs may be obtained indirectly through API calls. Many open redirect problems occur because the programmer assumed that certain inputs could not be modified, such as cookies and hidden form fields.::PHASE:Operation:STRATEGY:Firewall:DESCRIPTION:Use an application firewall that can detect attacks against this weakness. It can be beneficial in cases in which the code cannot be fixed (because it is controlled by a third party), as an emergency prevention measure while more comprehensive software assurance measures are applied, or to provide defense in depth.:EFFECTIVENESS:Moderate::"
