cweid,Name,Weakness Abstraction,Status,Description,Modes Of Introduction,Common Consequences,Detection Methods,potential_mitigation
297,Improper Validation of Certificate with Host Mismatch,Variant,Incomplete,"The product communicates with a host that provides a certificate, but the product does not properly ensure that the certificate is actually associated with that host.","::PHASE:Implementation:NOTE:When the product uses certificate pinning, the developer might not properly validate all relevant components of the certificate before pinning the certificate. This can make it difficult or expensive to test after the pinning is complete.::PHASE:Implementation:NOTE:REALIZATION: This weakness is caused during implementation of an architectural security tactic.::",::SCOPE:Access Control:IMPACT:Gain Privileges or Assume Identity:NOTE:The data read from the system vouched for by the certificate may not be from the expected system.::SCOPE:Authentication:SCOPE:Other:IMPACT:Other:NOTE:Trust afforded to the system in question - based on the malicious certificate - may allow for spoofing or redirection attacks.::,"::METHOD:Automated Static Analysis:DESCRIPTION:Automated static analysis, commonly referred to as Static Application Security Testing (SAST), can find some instances of this weakness by analyzing source code (or binary/compiled code) without having to execute it. Typically, this is done by building a model of data flow and control flow, then searching for potentially-vulnerable patterns that connect sources (origins of input) with sinks (destinations where the data interacts with external components, a lower layer such as the OS, etc.):EFFECTIVENESS:High::METHOD:Dynamic Analysis with Manual Results Interpretation:DESCRIPTION:Set up an untrusted endpoint (e.g. a server) with which the product will connect. Create a test certificate that uses an invalid hostname but is signed by a trusted CA and provide this certificate from the untrusted endpoint. If the product performs any operations instead of disconnecting and reporting an error, then this indicates that the hostname is not being checked and the test certificate has been accepted.::METHOD:Black Box:DESCRIPTION:When Certificate Pinning is being used in a mobile application, consider using a tool such as Spinner [REF-955]. This methodology might be extensible to other technologies.::","::PHASE:Architecture and Design:DESCRIPTION:Fully check the hostname of the certificate and provide the user with adequate information about the nature of the problem and how to proceed.::PHASE:Implementation:DESCRIPTION:If certificate pinning is being used, ensure that all relevant properties of the certificate are fully validated before the certificate is pinned, including the hostname.::"
300,Channel Accessible by Non-Endpoint,Class,Draft,"The product does not adequately verify the identity of actors at both ends of a communication channel, or does not adequately ensure the integrity of the channel, in a way that allows the channel to be accessed or influenced by an actor that is not an endpoint.",::PHASE:Architecture and Design:NOTE:REALIZATION: This weakness is caused during implementation of an architectural security tactic.::,::SCOPE:Confidentiality:SCOPE:Integrity:SCOPE:Access Control:IMPACT:Read Application Data:IMPACT:Modify Application Data:IMPACT:Gain Privileges or Assume Identity:NOTE:An attacker could pose as one of the entities and read or possibly modify the communication.::,"::METHOD:Automated Static Analysis:DESCRIPTION:Automated static analysis, commonly referred to as Static Application Security Testing (SAST), can find some instances of this weakness by analyzing source code (or binary/compiled code) without having to execute it. Typically, this is done by building a model of data flow and control flow, then searching for potentially-vulnerable patterns that connect sources (origins of input) with sinks (destinations where the data interacts with external components, a lower layer such as the OS, etc.):EFFECTIVENESS:High::","::PHASE:Implementation:DESCRIPTION:Always fully authenticate both ends of any communications channel.::PHASE:Architecture and Design:DESCRIPTION:Adhere to the principle of complete mediation.::PHASE:Implementation:DESCRIPTION:A certificate binds an identity to a cryptographic key to authenticate a communicating party. Often, the certificate takes the encrypted form of the hash of the identity of the subject, the public key, and information such as time of issue or expiration using the issuer's private key. The certificate can be validated by deciphering the certificate with the issuer's public key. See also X.509 certificate signature chains and the PGP certification structure.::"
302,Authentication Bypass by Assumed-Immutable Data,Base,Incomplete,"The authentication scheme or implementation uses key data elements that are assumed to be immutable, but can be controlled or modified by the attacker.",::PHASE:Architecture and Design:NOTE:COMMISSION: This weakness refers to an incorrect design related to an architectural security tactic.::PHASE:Implementation::,::SCOPE:Access Control:IMPACT:Bypass Protection Mechanism::,,"::PHASE:Architecture and Design Operation Implementation:DESCRIPTION:Implement proper protection for immutable data (e.g. environment variable, hidden form fields, etc.)::"
304,Missing Critical Step in Authentication,Base,Draft,"The product implements an authentication technique, but it skips a step that weakens the technique.",::PHASE:Implementation:NOTE:REALIZATION: This weakness is caused during implementation of an architectural security tactic.::,"::SCOPE:Access Control:SCOPE:Integrity:SCOPE:Confidentiality:IMPACT:Bypass Protection Mechanism:IMPACT:Gain Privileges or Assume Identity:IMPACT:Read Application Data:IMPACT:Execute Unauthorized Code or Commands:NOTE:This weakness can lead to the exposure of resources or functionality to unintended actors, possibly providing attackers with sensitive information or allowing attackers to execute arbitrary code.::","::METHOD:Automated Static Analysis:DESCRIPTION:Automated static analysis, commonly referred to as Static Application Security Testing (SAST), can find some instances of this weakness by analyzing source code (or binary/compiled code) without having to execute it. Typically, this is done by building a model of data flow and control flow, then searching for potentially-vulnerable patterns that connect sources (origins of input) with sinks (destinations where the data interacts with external components, a lower layer such as the OS, etc.):EFFECTIVENESS:High::",
306,Missing Authentication for Critical Function,Base,Draft,The product does not perform any authentication for functionality that requires a provable user identity or consumes a significant amount of resources.,::PHASE:Architecture and Design:NOTE:OMISSION: This weakness is caused by missing a security tactic during the architecture and design phase.::,"::SCOPE:Access Control:SCOPE:Other:IMPACT:Gain Privileges or Assume Identity:IMPACT:Other:NOTE:Exposing critical functionality essentially provides an attacker with the privilege level of that functionality. The consequences will depend on the associated functionality, but they can range from reading or modifying sensitive data, access to administrative or other privileged functionality, or possibly even execution of arbitrary code.::","::METHOD:Manual Analysis:DESCRIPTION:This weakness can be detected using tools and techniques that require manual (human) analysis, such as penetration testing, threat modeling, and interactive tools that allow the tester to record and modify an active session. Specifically, manual static analysis is useful for evaluating the correctness of custom authentication mechanisms.::METHOD:Automated Static Analysis:DESCRIPTION:Automated static analysis is useful for detecting commonly-used idioms for authentication. A tool may be able to analyze related configuration files, such as .htaccess in Apache web servers, or detect the usage of commonly-used authentication libraries. Generally, automated static analysis tools have difficulty detecting custom authentication schemes. In addition, the software's design may include some functionality that is accessible to any user and does not require an established identity; an automated technique that detects the absence of authentication may report false positives.:EFFECTIVENESS:Limited::METHOD:Manual Static Analysis - Binary or Bytecode:DESCRIPTION:According to SOAR, the following detection techniques may be useful: Cost effective for partial coverage: Binary / Bytecode disassembler - then use manual analysis for vulnerabilities & anomalies:EFFECTIVENESS:SOAR Partial::METHOD:Dynamic Analysis with Automated Results Interpretation:DESCRIPTION:According to SOAR, the following detection techniques may be useful: Cost effective for partial coverage: Web Application Scanner Web Services Scanner Database Scanners:EFFECTIVENESS:SOAR Partial::METHOD:Dynamic Analysis with Manual Results Interpretation:DESCRIPTION:According to SOAR, the following detection techniques may be useful: Cost effective for partial coverage: Host Application Interface Scanner Fuzz Tester Framework-based Fuzzer:EFFECTIVENESS:SOAR Partial::METHOD:Manual Static Analysis - Source Code:DESCRIPTION:According to SOAR, the following detection techniques may be useful: Cost effective for partial coverage: Focused Manual Spotcheck - Focused manual analysis of source Manual Source Code Review (not inspections):EFFECTIVENESS:SOAR Partial::METHOD:Automated Static Analysis - Source Code:DESCRIPTION:According to SOAR, the following detection techniques may be useful: Cost effective for partial coverage: Source code Weakness Analyzer Context-configured Source Code Weakness Analyzer:EFFECTIVENESS:SOAR Partial::METHOD:Architecture or Design Review:DESCRIPTION:According to SOAR, the following detection techniques may be useful: Highly cost effective: Inspection (IEEE 1028 standard) (can apply to requirements, design, source code, etc.) Formal Methods / Correct-By-Construction Cost effective for partial coverage: Attack Modeling:EFFECTIVENESS:High::","::PHASE:Architecture and Design:DESCRIPTION:Divide the software into anonymous, normal, privileged, and administrative areas. Identify which of these areas require a proven user identity, and use a centralized authentication capability. Identify all potential communication channels, or other means of interaction with the software, to ensure that all channels are appropriately protected. Developers sometimes perform authentication at the primary channel, but open up a secondary channel that is assumed to be private. For example, a login mechanism may be listening on one network port, but after successful authentication, it may open up a second port where it waits for the connection, but avoids authentication because it assumes that only the authenticated party will connect to the port. In general, if the software or protocol allows a single session or user state to persist across multiple connections or channels, authentication and appropriate credential management need to be used throughout.::PHASE:Architecture and Design:DESCRIPTION:For any security checks that are performed on the client side, ensure that these checks are duplicated on the server side, in order to avoid CWE-602. Attackers can bypass the client-side checks by modifying values after the checks have been performed, or by changing the client to remove the client-side checks entirely. Then, these modified values would be submitted to the server.::PHASE:Architecture and Design:DESCRIPTION:Where possible, avoid implementing custom authentication routines and consider using authentication capabilities as provided by the surrounding framework, operating system, or environment. These may make it easier to provide a clear separation between authentication tasks and authorization tasks. In environments such as the World Wide Web, the line between authentication and authorization is sometimes blurred. If custom authentication routines are required instead of those provided by the server, then these routines must be applied to every single page, since these pages could be requested directly.::PHASE:Architecture and Design:STRATEGY:Libraries or Frameworks:DESCRIPTION:Use a vetted library or framework that does not allow this weakness to occur or provides constructs that make this weakness easier to avoid. For example, consider using libraries with authentication capabilities such as OpenSSL or the ESAPI Authenticator [REF-45].::PHASE:Implementation System Configuration Operation:DESCRIPTION:When storing data in the cloud (e.g., S3 buckets, Azure blobs, Google Cloud Storage, etc.), use the provider's controls to require strong authentication for users who should be allowed to access the data [REF-1297] [REF-1298] [REF-1302].::"
307,Improper Restriction of Excessive Authentication Attempts,Base,Draft,"The product does not implement sufficient measures to prevent multiple failed authentication attempts within a short time frame, making it more susceptible to brute force attacks.",::PHASE:Architecture and Design:NOTE:COMMISSION: This weakness refers to an incorrect design related to an architectural security tactic.::,"::SCOPE:Access Control:IMPACT:Bypass Protection Mechanism:NOTE:An attacker could perform an arbitrary number of authentication attempts using different passwords, and eventually gain access to the targeted account.::","::METHOD:Dynamic Analysis with Automated Results Interpretation:DESCRIPTION:According to SOAR, the following detection techniques may be useful: Highly cost effective: Web Application Scanner Web Services Scanner Database Scanners Cost effective for partial coverage: Host-based Vulnerability Scanners - Examine configuration for flaws, verifying that audit mechanisms work, ensure host configuration meets certain predefined criteria:EFFECTIVENESS:High::METHOD:Dynamic Analysis with Manual Results Interpretation:DESCRIPTION:According to SOAR, the following detection techniques may be useful: Highly cost effective: Fuzz Tester Framework-based Fuzzer Cost effective for partial coverage: Forced Path Execution:EFFECTIVENESS:High::METHOD:Manual Static Analysis - Source Code:DESCRIPTION:According to SOAR, the following detection techniques may be useful: Highly cost effective: Focused Manual Spotcheck - Focused manual analysis of source Manual Source Code Review (not inspections):EFFECTIVENESS:High::METHOD:Automated Static Analysis - Source Code:DESCRIPTION:According to SOAR, the following detection techniques may be useful: Cost effective for partial coverage: Source code Weakness Analyzer Context-configured Source Code Weakness Analyzer:EFFECTIVENESS:SOAR Partial::METHOD:Automated Static Analysis:DESCRIPTION:According to SOAR, the following detection techniques may be useful: Cost effective for partial coverage: Configuration Checker:EFFECTIVENESS:SOAR Partial::METHOD:Architecture or Design Review:DESCRIPTION:According to SOAR, the following detection techniques may be useful: Highly cost effective: Formal Methods / Correct-By-Construction Cost effective for partial coverage: Inspection (IEEE 1028 standard) (can apply to requirements, design, source code, etc.):EFFECTIVENESS:High::",::PHASE:Architecture and Design:DESCRIPTION:Common protection mechanisms include: Disconnecting the user after a small number of failed attempts Implementing a timeout Locking out a targeted account Requiring a computational task on the user's part.::PHASE:Architecture and Design:STRATEGY:Libraries or Frameworks:DESCRIPTION:Use a vetted library or framework that does not allow this weakness to occur or provides constructs that make this weakness easier to avoid. Consider using libraries with authentication capabilities such as OpenSSL or the ESAPI Authenticator. [REF-45]::
311,Missing Encryption of Sensitive Data,Class,Draft,The product does not encrypt sensitive or critical information before storage or transmission.,::PHASE:Architecture and Design:NOTE:OMISSION: This weakness is caused by missing a security tactic during the architecture and design phase.::PHASE:Operation::,"::SCOPE:Confidentiality:IMPACT:Read Application Data:NOTE:If the application does not use a secure channel, such as SSL, to exchange sensitive information, it is possible for an attacker with access to the network traffic to sniff packets from the connection and uncover the data. This attack is not technically difficult, but does require physical access to some portion of the network over which the sensitive data travels. This access is usually somewhere near where the user is connected to the network (such as a colleague on the company network) but can be anywhere along the path from the user to the end server.::SCOPE:Confidentiality:SCOPE:Integrity:IMPACT:Modify Application Data:NOTE:Omitting the use of encryption in any program which transfers data over a network of any kind should be considered on par with delivering the data sent to each user on the local networks of both the sender and receiver. Worse, this omission allows for the injection of data into a stream of communication between two parties -- with no means for the victims to separate valid data from invalid. In this day of widespread network attacks and password collection sniffers, it is an unnecessary risk to omit encryption from the design of any system which might benefit from it.::","::METHOD:Manual Analysis:DESCRIPTION:The characterizaton of sensitive data often requires domain-specific understanding, so manual methods are useful. However, manual efforts might not achieve desired code coverage within limited time constraints. Black box methods may produce artifacts (e.g. stored data or unencrypted network transfer) that require manual evaluation.:EFFECTIVENESS:High::METHOD:Automated Analysis:DESCRIPTION:Automated measurement of the entropy of an input/output source may indicate the use or lack of encryption, but human analysis is still required to distinguish intentionally-unencrypted data (e.g. metadata) from sensitive data.::METHOD:Manual Static Analysis - Binary or Bytecode:DESCRIPTION:According to SOAR, the following detection techniques may be useful: Cost effective for partial coverage: Binary / Bytecode disassembler - then use manual analysis for vulnerabilities & anomalies:EFFECTIVENESS:SOAR Partial::METHOD:Dynamic Analysis with Automated Results Interpretation:DESCRIPTION:According to SOAR, the following detection techniques may be useful: Cost effective for partial coverage: Web Application Scanner Web Services Scanner Database Scanners:EFFECTIVENESS:SOAR Partial::METHOD:Dynamic Analysis with Manual Results Interpretation:DESCRIPTION:According to SOAR, the following detection techniques may be useful: Highly cost effective: Network Sniffer Cost effective for partial coverage: Fuzz Tester Framework-based Fuzzer Automated Monitored Execution Man-in-the-middle attack tool:EFFECTIVENESS:High::METHOD:Manual Static Analysis - Source Code:DESCRIPTION:According to SOAR, the following detection techniques may be useful: Highly cost effective: Focused Manual Spotcheck - Focused manual analysis of source Manual Source Code Review (not inspections):EFFECTIVENESS:High::METHOD:Automated Static Analysis - Source Code:DESCRIPTION:According to SOAR, the following detection techniques may be useful: Cost effective for partial coverage: Context-configured Source Code Weakness Analyzer:EFFECTIVENESS:SOAR Partial::METHOD:Architecture or Design Review:DESCRIPTION:According to SOAR, the following detection techniques may be useful: Highly cost effective: Inspection (IEEE 1028 standard) (can apply to requirements, design, source code, etc.) Formal Methods / Correct-By-Construction Cost effective for partial coverage: Attack Modeling:EFFECTIVENESS:High::","::PHASE:Requirements:DESCRIPTION:Clearly specify which data or resources are valuable enough that they should be protected by encryption. Require that any transmission or storage of this data/resource should use well-vetted encryption algorithms.::PHASE:Architecture and Design:DESCRIPTION:Ensure that encryption is properly integrated into the system design, including but not necessarily limited to: Encryption that is needed to store or transmit private data of the users of the system Encryption that is needed to protect the system itself from unauthorized disclosure or tampering Identify the separate needs and contexts for encryption: One-way (i.e., only the user or recipient needs to have the key). This can be achieved using public key cryptography, or other techniques in which the encrypting party (i.e., the product) does not need to have access to a private key. Two-way (i.e., the encryption can be automatically performed on behalf of a user, but the key must be available so that the plaintext can be automatically recoverable by that user). This requires storage of the private key in a format that is recoverable only by the user (or perhaps by the operating system) in a way that cannot be recovered by others. Using threat modeling or other techniques, assume that data can be compromised through a separate vulnerability or weakness, and determine where encryption will be most effective. Ensure that data that should be private is not being inadvertently exposed using weaknesses such as insecure permissions (CWE-732). [REF-7]::PHASE:Architecture and Design:STRATEGY:Libraries or Frameworks:DESCRIPTION:When there is a need to store or transmit sensitive data, use strong, up-to-date cryptographic algorithms to encrypt that data. Select a well-vetted algorithm that is currently considered to be strong by experts in the field, and use well-tested implementations. As with all cryptographic mechanisms, the source code should be available for analysis. For example, US government systems require FIPS 140-2 certification. Do not develop custom or private cryptographic algorithms. They will likely be exposed to attacks that are well-understood by cryptographers. Reverse engineering techniques are mature. If the algorithm can be compromised if attackers find out how it works, then it is especially weak. Periodically ensure that the cryptography has not become obsolete. Some older algorithms, once thought to require a billion years of computing time, can now be broken in days or hours. This includes MD4, MD5, SHA1, DES, and other algorithms that were once regarded as strong. [REF-267]::PHASE:Architecture and Design:STRATEGY:Separation of Privilege:DESCRIPTION:Compartmentalize the system to have safe areas where trust boundaries can be unambiguously drawn. Do not allow sensitive data to go outside of the trust boundary and always be careful when interfacing with a compartment outside of the safe area. Ensure that appropriate compartmentalization is built into the system design, and the compartmentalization allows for and reinforces privilege separation functionality. Architects and designers should rely on the principle of least privilege to decide the appropriate time to use privileges and the time to drop privileges.::PHASE:Implementation Architecture and Design:DESCRIPTION:When using industry-approved techniques, use them correctly. Don't cut corners by skipping resource-intensive steps (CWE-325). These steps are often essential for preventing common attacks.::PHASE:Implementation:STRATEGY:Attack Surface Reduction:DESCRIPTION:Use naming conventions and strong types to make it easier to spot when sensitive data is being used. When creating structures, objects, or other complex entities, separate the sensitive and non-sensitive data as much as possible.:EFFECTIVENESS:Defense in Depth::"
312,Cleartext Storage of Sensitive Information,Base,Draft,The product stores sensitive information in cleartext within a resource that might be accessible to another control sphere.,::PHASE:Architecture and Design:NOTE:OMISSION: This weakness is caused by missing a security tactic during the architecture and design phase.::,::SCOPE:Confidentiality:IMPACT:Read Application Data:NOTE:An attacker with access to the system could read sensitive information stored in cleartext.::,"::METHOD:Automated Static Analysis:DESCRIPTION:Automated static analysis, commonly referred to as Static Application Security Testing (SAST), can find some instances of this weakness by analyzing source code (or binary/compiled code) without having to execute it. Typically, this is done by building a model of data flow and control flow, then searching for potentially-vulnerable patterns that connect sources (origins of input) with sinks (destinations where the data interacts with external components, a lower layer such as the OS, etc.):EFFECTIVENESS:High::","::PHASE:Implementation System Configuration Operation:DESCRIPTION:When storing data in the cloud (e.g., S3 buckets, Azure blobs, Google Cloud Storage, etc.), use the provider's controls to encrypt the data at rest. [REF-1297] [REF-1299] [REF-1301]::"
313,Cleartext Storage in a File or on Disk,Variant,Draft,"The product stores sensitive information in cleartext in a file, or on disk.",::PHASE:Architecture and Design:NOTE:OMISSION: This weakness is caused by missing a security tactic during the architecture and design phase.::,::SCOPE:Confidentiality:IMPACT:Read Application Data::,"::METHOD:Automated Static Analysis:DESCRIPTION:Automated static analysis, commonly referred to as Static Application Security Testing (SAST), can find some instances of this weakness by analyzing source code (or binary/compiled code) without having to execute it. Typically, this is done by building a model of data flow and control flow, then searching for potentially-vulnerable patterns that connect sources (origins of input) with sinks (destinations where the data interacts with external components, a lower layer such as the OS, etc.):EFFECTIVENESS:High::",
