cweid,Name,Weakness Abstraction,Status,Description,Modes Of Introduction,Common Consequences,Detection Methods,potential_mitigation
11,ASP.NET Misconfiguration: Creating Debug Binary,Variant,Draft,Debugging messages help attackers learn about the system and plan a form of attack.,::PHASE:Implementation::PHASE:Build and Compilation::,"::SCOPE:Confidentiality:IMPACT:Read Application Data:NOTE:Attackers can leverage the additional information they gain from debugging output to mount attacks targeted on the framework, database, or other resources used by the application.::","::METHOD:Automated Static Analysis:DESCRIPTION:Automated static analysis, commonly referred to as Static Application Security Testing (SAST), can find some instances of this weakness by analyzing source code (or binary/compiled code) without having to execute it. Typically, this is done by building a model of data flow and control flow, then searching for potentially-vulnerable patterns that connect sources (origins of input) with sinks (destinations where the data interacts with external components, a lower layer such as the OS, etc.):EFFECTIVENESS:High::",::PHASE:System Configuration:DESCRIPTION:Avoid releasing debug binaries into the production environment. Change the debug mode to false when the application is deployed into production.::
13,ASP.NET Misconfiguration: Password in Configuration File,Variant,Draft,Storing a plaintext password in a configuration file allows anyone who can read the file access to the password-protected resource making them an easy target for attackers.,::PHASE:Architecture and Design::PHASE:Implementation::,::SCOPE:Access Control:IMPACT:Gain Privileges or Assume Identity::,,"::PHASE:Implementation:DESCRIPTION:Credentials stored in configuration files should be encrypted, Use standard APIs and industry accepted algorithms to encrypt the credentials stored in configuration files.::"
15,External Control of System or Configuration Setting,Base,Incomplete,One or more system settings or configuration elements can be externally controlled by a user.,"::PHASE:Implementation:NOTE:Setting manipulation vulnerabilities occur when an attacker can control values that govern the behavior of the system, manage specific resources, or in some way affect the functionality of the application.::PHASE:Implementation:NOTE:REALIZATION: This weakness is caused during implementation of an architectural security tactic.::",::SCOPE:Other:IMPACT:Varies by Context::,"::METHOD:Automated Static Analysis:DESCRIPTION:Automated static analysis, commonly referred to as Static Application Security Testing (SAST), can find some instances of this weakness by analyzing source code (or binary/compiled code) without having to execute it. Typically, this is done by building a model of data flow and control flow, then searching for potentially-vulnerable patterns that connect sources (origins of input) with sinks (destinations where the data interacts with external components, a lower layer such as the OS, etc.):EFFECTIVENESS:High::","::PHASE:Architecture and Design:STRATEGY:Separation of Privilege:DESCRIPTION:Compartmentalize the system to have safe areas where trust boundaries can be unambiguously drawn. Do not allow sensitive data to go outside of the trust boundary and always be careful when interfacing with a compartment outside of the safe area. Ensure that appropriate compartmentalization is built into the system design, and the compartmentalization allows for and reinforces privilege separation functionality. Architects and designers should rely on the principle of least privilege to decide the appropriate time to use privileges and the time to drop privileges.::PHASE:Implementation Architecture and Design:DESCRIPTION:Because setting manipulation covers a diverse set of functions, any attempt at illustrating it will inevitably be incomplete. Rather than searching for a tight-knit relationship between the functions addressed in the setting manipulation category, take a step back and consider the sorts of system values that an attacker should not be allowed to control.::PHASE:Implementation Architecture and Design:DESCRIPTION:In general, do not allow user-provided or otherwise untrusted data to control sensitive values. The leverage that an attacker gains by controlling these values is not always immediately obvious, but do not underestimate the creativity of the attacker.::"
20,Improper Input Validation,Class,Stable,"The product receives input or data, but it does not validate or incorrectly validates that the input has the properties that are required to process the data safely and correctly.","::PHASE:Architecture and Design::PHASE:Implementation:NOTE:REALIZATION: This weakness is caused during implementation of an architectural security tactic. If a programmer believes that an attacker cannot modify certain inputs, then the programmer might not perform any input validation at all. For example, in web applications, many programmers believe that cookies and hidden form fields can not be modified from a web browser (CWE-472), although they can be altered using a proxy or a custom program. In a client-server architecture, the programmer might assume that client-side security checks cannot be bypassed, even when a custom client could be written that skips those checks (CWE-602).::","::SCOPE:Availability:IMPACT:DoS: Crash, Exit, or Restart:IMPACT:DoS: Resource Consumption (CPU):IMPACT:DoS: Resource Consumption (Memory):NOTE:An attacker could provide unexpected values and cause a program crash or excessive consumption of resources, such as memory and CPU.::SCOPE:Confidentiality:IMPACT:Read Memory:IMPACT:Read Files or Directories:NOTE:An attacker could read confidential data if they are able to control resource references.::SCOPE:Integrity:SCOPE:Confidentiality:SCOPE:Availability:IMPACT:Modify Memory:IMPACT:Execute Unauthorized Code or Commands:NOTE:An attacker could use malicious input to modify data or possibly alter control flow in unexpected ways, including arbitrary command execution.::","::METHOD:Automated Static Analysis:DESCRIPTION:Some instances of improper input validation can be detected using automated static analysis. A static analysis tool might allow the user to specify which application-specific methods or functions perform input validation; the tool might also have built-in knowledge of validation frameworks such as Struts. The tool may then suppress or de-prioritize any associated warnings. This allows the analyst to focus on areas of the software in which input validation does not appear to be present. Except in the cases described in the previous paragraph, automated static analysis might not be able to recognize when proper input validation is being performed, leading to false positives - i.e., warnings that do not have any security consequences or require any code changes.::METHOD:Manual Static Analysis:DESCRIPTION:When custom input validation is required, such as when enforcing business rules, manual analysis is necessary to ensure that the validation is properly implemented.::METHOD:Fuzzing:DESCRIPTION:Fuzzing techniques can be useful for detecting input validation errors. When unexpected inputs are provided to the software, the software should not crash or otherwise become unstable, and it should generate application-controlled error messages. If exceptions or interpreter-generated error messages occur, this indicates that the input was not detected and handled within the application logic itself.::METHOD:Automated Static Analysis - Binary or Bytecode:DESCRIPTION:According to SOAR, the following detection techniques may be useful: Cost effective for partial coverage: Bytecode Weakness Analysis - including disassembler + source code weakness analysis Binary Weakness Analysis - including disassembler + source code weakness analysis:EFFECTIVENESS:SOAR Partial::METHOD:Manual Static Analysis - Binary or Bytecode:DESCRIPTION:According to SOAR, the following detection techniques may be useful: Cost effective for partial coverage: Binary / Bytecode disassembler - then use manual analysis for vulnerabilities & anomalies:EFFECTIVENESS:SOAR Partial::METHOD:Dynamic Analysis with Automated Results Interpretation:DESCRIPTION:According to SOAR, the following detection techniques may be useful: Highly cost effective: Web Application Scanner Web Services Scanner Database Scanners:EFFECTIVENESS:High::METHOD:Dynamic Analysis with Manual Results Interpretation:DESCRIPTION:According to SOAR, the following detection techniques may be useful: Highly cost effective: Fuzz Tester Framework-based Fuzzer Cost effective for partial coverage: Host Application Interface Scanner Monitored Virtual Environment - run potentially malicious code in sandbox / wrapper / virtual machine, see if it does anything suspicious:EFFECTIVENESS:High::METHOD:Manual Static Analysis - Source Code:DESCRIPTION:According to SOAR, the following detection techniques may be useful: Highly cost effective: Focused Manual Spotcheck - Focused manual analysis of source Manual Source Code Review (not inspections):EFFECTIVENESS:High::METHOD:Automated Static Analysis - Source Code:DESCRIPTION:According to SOAR, the following detection techniques may be useful: Highly cost effective: Source code Weakness Analyzer Context-configured Source Code Weakness Analyzer:EFFECTIVENESS:High::METHOD:Architecture or Design Review:DESCRIPTION:According to SOAR, the following detection techniques may be useful: Highly cost effective: Inspection (IEEE 1028 standard) (can apply to requirements, design, source code, etc.) Formal Methods / Correct-By-Construction Cost effective for partial coverage: Attack Modeling:EFFECTIVENESS:High::","::PHASE:Architecture and Design:STRATEGY:Attack Surface Reduction:DESCRIPTION:Consider using language-theoretic security (LangSec) techniques that characterize inputs using a formal language and build recognizers for that language. This effectively requires parsing to be a distinct layer that effectively enforces a boundary between raw input and internal data representations, instead of allowing parser code to be scattered throughout the program, where it could be subject to errors or inconsistencies that create weaknesses. [REF-1109] [REF-1110] [REF-1111]::PHASE:Architecture and Design:STRATEGY:Libraries or Frameworks:DESCRIPTION:Use an input validation framework such as Struts or the OWASP ESAPI Validation API. Note that using a framework does not automatically address all input validation problems; be mindful of weaknesses that could arise from misusing the framework itself (CWE-1173).::PHASE:Architecture and Design Implementation:STRATEGY:Attack Surface Reduction:DESCRIPTION:Understand all the potential areas where untrusted inputs can enter your software: parameters or arguments, cookies, anything read from the network, environment variables, reverse DNS lookups, query results, request headers, URL components, e-mail, files, filenames, databases, and any external systems that provide data to the application. Remember that such inputs may be obtained indirectly through API calls.::PHASE:Implementation:STRATEGY:Input Validation:DESCRIPTION:Assume all input is malicious. Use an accept known good input validation strategy, i.e., use a list of acceptable inputs that strictly conform to specifications. Reject any input that does not strictly conform to specifications, or transform it into something that does. When performing input validation, consider all potentially relevant properties, including length, type of input, the full range of acceptable values, missing or extra inputs, syntax, consistency across related fields, and conformance to business rules. As an example of business rule logic, boat may be syntactically valid because it only contains alphanumeric characters, but it is not valid if the input is only expected to contain colors such as red or blue. Do not rely exclusively on looking for malicious or malformed inputs. This is likely to miss at least one undesirable input, especially if the code's environment changes. This can give attackers enough room to bypass the intended validation. However, denylists can be useful for detecting potential attacks or determining which inputs are so malformed that they should be rejected outright.:EFFECTIVENESS:High::PHASE:Architecture and Design:DESCRIPTION:For any security checks that are performed on the client side, ensure that these checks are duplicated on the server side, in order to avoid CWE-602. Attackers can bypass the client-side checks by modifying values after the checks have been performed, or by changing the client to remove the client-side checks entirely. Then, these modified values would be submitted to the server. Even though client-side checks provide minimal benefits with respect to server-side security, they are still useful. First, they can support intrusion detection. If the server receives input that should have been rejected by the client, then it may be an indication of an attack. Second, client-side error-checking can provide helpful feedback to the user about the expectations for valid input. Third, there may be a reduction in server-side processing time for accidental input errors, although this is typically a small savings.::PHASE:Implementation:DESCRIPTION:When your application combines data from multiple sources, perform the validation after the sources have been combined. The individual data elements may pass the validation step but violate the intended restrictions after they have been combined.::PHASE:Implementation:DESCRIPTION:Be especially careful to validate all input when invoking code that crosses language boundaries, such as from an interpreted language to native code. This could create an unexpected interaction between the language boundaries. Ensure that you are not violating any of the expectations of the language with which you are interfacing. For example, even though Java may not be susceptible to buffer overflows, providing a large argument in a call to native code might trigger an overflow.::PHASE:Implementation:DESCRIPTION:Directly convert your input type into the expected data type, such as using a conversion function that translates a string into a number. After converting to the expected data type, ensure that the input's values fall within the expected range of allowable values and that multi-field consistencies are maintained.::PHASE:Implementation:DESCRIPTION:Inputs should be decoded and canonicalized to the application's current internal representation before being validated (CWE-180, CWE-181). Make sure that your application does not inadvertently decode the same input twice (CWE-174). Such errors could be used to bypass allowlist schemes by introducing dangerous inputs after they have been checked. Use libraries such as the OWASP ESAPI Canonicalization control. Consider performing repeated canonicalization until your input does not change any more. This will avoid double-decoding and similar scenarios, but it might inadvertently modify inputs that are allowed to contain properly-encoded dangerous content.::PHASE:Implementation:DESCRIPTION:When exchanging data between components, ensure that both components are using the same character encoding. Ensure that the proper encoding is applied at each interface. Explicitly set the encoding you are using whenever the protocol allows you to do so.::"
